movie,title,genres,year,Rating,RottenTomato
6433,"Man with the Movie Camera, The (Chelovek s kino-apparatom)",Documentary,1929,3,74
25763,"Pandora's Box (Büchse der Pandora, Die)",Drama,1929,10,56
25771,"Andalusian Dog, An (Chien andalou, Un)",Fantasy,1929,8,62
2219,Murder!,Mystery|Thriller,1929,5,70
4970,"Blue Angel, The (Blaue Engel, Der)",Drama,1929,7,95
7706,Animal Crackers,Comedy|Musical,1929,5,90
25774,"Golden Age, The (Âge d'Or, L')",Comedy|Drama|Romance,1929,3,89
151307,The Lovers and the,(no genres listed),1929,8,97
